,Title,Year,Genre,Synopsis,IMDb id
605,Born in Jerusalem and Still Alive,2019,Drama,"During the days of the Israeli withdrawal from the settlements in the Gaza strip, when the residents of the Katif Settlements are uniting to fight for its existence, Ruth, a young teenager from the settlement, is searching for excitement. When Ruth meets Erez, a photojournalist sent to cover the events of the disengagement, she realizes that she doesn't belong anywhere. ""Ruth"" is an adolescence story of a young girl living in the most dangerous place in Israel. In a society demanding a united front and common beliefs, Ruth fights to interpret her faith in her own way. It is not a political struggle but the struggle of one girl for the privilege of holding an independent opinion in a social surrounding which strongly embraces a united point of view dictated from above.::Keren Abitan",9811480
606,Amazing Grace,1992,Drama,A man travels from America travels to Israel to collect his inheritance and becomes temporarily insane in the holy city.,0104414
607,Abba Ganuv III,1991,Adventure,NA,0133333
608,Final Exams,1983,Drama,"Release the Princess is a gimmick-filled TV show known for its extravagant prizes. Its dungeon-like set features a hanging cage in which a beautiful, helpless Princess is held, waiting for the contestant who will succeed in releasing her.",0085541
609,Uncle Peretz Takes Off,1993,Drama,NA,0176659
610,The End of Milton Levy,1981,Drama,"At the beginning of the 20th century, a language war raged in Palestine. The contenders: Yiddish, Russian, French, German, English, and Hebrew, a language barely spoken for 2000 years. This feature film tells the dramatic life story of Eliezer Ben-Yehuda who championed the cause of modern Hebrew.::National Center for Jewish Film",0146281
611,The Wanderer,2010,"Comedy, Drama, Music","Nony, a shy college student, suffers severe shell shock in the Third Lebanon War. In an experimental treatment, the psychiatrist instructs his friends and family to play along with Nony's delusion that he is now a rock star named Amnon.",1646969
612,Hello Goodbye,2008,Drama,NA,1160012
613,The Alley,(III,Drama,"Named after the hot desert wind that periodically blows through the Middle East sending temperatures and tempers soaring to potentially explosive heights. Set in an old farming village in the Galilee, the story revolves around inherited land ownership of Israelis and Arabs, of disappointed dreams, political tensions, and torn emotions as the clash between love and nationalism spiral to a tragic end.::Anonymous",5439790
614,The Dinner,2020,Drama,Strap yourself in for an exhilarating journey into darkness with these five award-winning short films from across the globe that delve into heart-pumping escapades varying from the intensely erotic to the ultra-violent to the warm-inside feels. The night has never looked so inviting.::NQV Media,10218878
615,Scratch,2007,Drama,A gently satirical tale of a man and his family trapped by military blockade inside a tiny Arab village in Israel.,2239012
616,The Voice of Hope,1997,"Drama, Romance","""All of those romantic movies are always in foreign cities. It's always Tokyo, Paris, Rome, New York. It's easier over there. The hardest thing is being romantic in your own city. Your city is always against you, trying to ruin it for you. It's not easy, all this romance"". Nico and Neta, two lonesome souls, embark on a romantic journey through the moonlit streets of Tel-Aviv, where they will meet all the beauty and vitality of the city, but also all of the hurt and suffering lying beneath its glittering veneer.::Anonymous",0143987
617,Mymym,2005,"Drama, Romance",NA,0497641
618,Here Comes the Sun,(II,Drama,"Aviva, a hard-working hotel cook in the northern Israeli town of Tiberias, is on the brink of finally fulfilling her lifelong dream. For years she kept her remarkable writing abilities under wraps, until her sister, Anita, introduces her to Oded, an accomplished novelist. Immediately recognizing Aviva's talent, Oded takes her under his wing, promising to help her achieve greatness. But the journey to greatness effects her life and the lives of her family - her unemployed husband, her trouble children, her unstable mother, and primarily her sister, a funny and sensitive woman who have her own dreams. When Aviva discovers that Oded has other plans for her work, her world collapses.::Jerusalem Film Festival",6443416
619,Buck Davis,,Drama,"Clara, a Polish born Jew, living in Tel Aviv of the 1970's, has her ideas about how people should behave, and runs everybody's life accordingly: her husband, her sisters, their husbands, their children, her brother who lives in London (probably because it was the only way to get away from her...). Whenever something ""improper"" does happen, Clara's way of handling it is simply to shove it under the carpet and ignore it completely, as if it never happened. 3 basic rules, are, of course: 1. Never marry some one ""under"" your class (Or the class you think you are). 2. Never become pregnant out of wedlock and 3. No Abortions. As one may expect, everything crumbles when her niece gives her no option, but to break at least one of those rules.::rzg@iec.co.il",6793840
620,Landsman,2009,Drama,"An aging Israeli unemployed director, manages to maneuver his way into getting a job directing a stage show. For the leading role he casts a young male street performer.",1438464
621,Magic Samson,1988,Drama,"Reveals at close range the two levels of emotions existing in individual lives in a kibbutz. An atmosphere of warmth and concern is expressed as Leah's repeated miscarriages cause the breakdown of her marriage. But the deeper, unspoken reasons unfold, and the close, scrutinizing aspect of the kibbutz community offers no privacy. She and her husband blames the other wordlessly, while individually beset with feelings of self-doubt and blame.::Anonymous",0151531
622,The Glow,2001,Drama,"Meduzot (the Hebrew word for Jellyfish) tells the story of three very different Israeli women living in Tel Aviv whose intersecting stories weave an unlikely portrait of modern Israeli life. Batya, a catering waitress, takes in a young child apparently abandoned at a local beach. Batya is one of the servers at the wedding reception of Keren, a young bride who breaks her leg in trying to escape from a locked toilet stall, which ruins her chance at a romantic honeymoon in the Caribbean. One of the guests is Joy, a Philippine chore woman attending the event with her employer, and who doesn't speak any Hebrew (she communicates mainly in English), and who is guilt-ridden after having left her young son behind in the Philippines.::Anonymous",0293720
623,Present Continuous,2012,"Comedy, Drama","7 Childhood friends meet up for dinner on the night of an eclipse. During which they play a game where whatever call, text and message they get on their phone must be shared with everyone and soon discover, no one is who they say they are.",2382050
624,White Chocolate,(I,"Action, Horror, Sci-Fi","In a post-apocalyptic future, a biological warfare program gone wrong leaves only four survivors defending themselves from ""the infected"" - mindless killers. As they struggle to survive and make sense of what is happening, they find another survivor, intent on revealing the truth.",1344335
625,Strangers,2007,"Drama, Romance","Joy can't let go of her ex, but doesn't seem to be able to fall for the new guy. In the meantime she keeps having casual sex with strangers.",1064215
626,Tetarti 04:45,2015,"Drama, Thriller",A Lebanese informer and an Israeli Mossad agent are trapped together in a safehouse where nothing is safe and no one can be trusted.,3737988
627,Checkout,2021,Drama,"27-year-old Guy lives in an old bus in Ramat Hagolan, not far from the Moshav where he grew up. He raises a herd of cattle for beef together with his younger brother, Jerry. One night, after hunting a wolf that was threatening the cattle, Guy celebrates and ends up drunk. On a dark road he causes an accident and crashes into another car. The driver of the other car, his best friend Yoav, is now paralyzed from the neck down. Two years later Guy comes out of prison to find only Jerry waiting to welcome him. His mother, Rachel, a nurse, cannot bring herself to forgive him. Guy braces himself and goes to visit Yoav, who only has one request, that Guy kill him. Guy is at a loss; the only thing he knows is that he loves Yoav. Guy tries to rebuild his life, to work with the herd, but can't put the accident and Yoav's request out of his mind. Meanwhile, the herd is under attack from a pack of wolves that must be killed. But Guy is unable to reach a decision: should he kill the wolves, Yoav or himself?::JCS Productions",10629014
628,Next to Her,2014,Drama,NA,3569978
629,Flawless,2018,Drama,Impressions from moments of observation. Forgotten lies. Man and woman. Sometime in the winter,8653840
630,Alex Holeh Ahavah,1986,"Music, Romance",A look at the chaos and confusion of love featuring livewire choreography and a thrumming electronic score,0133351
631,Self Made,2014,Drama,NA,3751304
632,ForgotteNation,2021,"Drama, War",NA,16263830
633,Jerusalem Syndrome,,NA,NA,3764486
634,Ovsunçu,2003,"Comedy, Crime",NA,0471291
635,Release the Princess,1999,NA,NA,7488322
636,The Winchell Affair,1979,"Action, Fantasy, Mystery",NA,0145957
637,The Kites Are Flying!,,Drama,"A Married Couple is a 1983 Israeli drama film directed by Yitzhak Yeshurun. The film was selected as the Israeli entry for the Best Foreign Language Film at the 56th Academy Awards, but was not accepted as a nominee.",6857094
638,Everything Is Broken Up and Dances,2016,Drama,"Two interconnected stories in the 1930s, one set in Berlin, the other in Palestine: Mania Vilbouchevich Shohat (1880-1961), called Tania, a Russian Jew and revolutionary, goes from Minsk to Palestine to live on a collective. She promotes feminism and laments a shift in the men from self-defense to aggression. Her friend, Else Lasker-Schuler (1869-1945), expressionist poet and German Jew, is in Berlin, writing, caring for her son, watching Hitler's movement take power. She goes to Jerusalem and imagines a park for Arab and Jew. Her poems, voiced from within, capture her experience. The film meditates on the violence at the root of Israel's birth: of the Nazis and of the Zionists.::<jhailey@hotmail.com>",5176794
639,Mabat Koev,1994,"Comedy, Romance","Vicky (Angelica Vale) travels to Israel dressed as a nun to find her estranged husband, who is an illegal salsa dancing teacher in Tel Aviv. On her way there she meets Yoni (Angel Bonanni), a shy University professor who helps her go through Israeli customs.::Anonymous",8362940
640,Noa at 17,1982,Fantasy,NA,0084417
641,Marzipan Flowers,2014,Drama,"During the Second Lebanon War, Motti and Keren, a young orthodox couple from the North of Israel, looks for a place to stay to escape the bombings and stress of their hometown near the border. They end up at the heart of suburbia, in Tel Aviv, at the bourgeois apartment Yali and Boaz. The spacious apartment suddenly seems crowded and small when tensions between the couples begin to mount. The situation is further complicated as Keren's obvious pregnancy adds to the pain of Boaz and Yali, who cannot have children of their own. The shifting relationships between the four serve to examine the tensions and complexities of Israeli society today.::Haifa Film Festival",3842994
642,Let It Be Morning,2021,Drama,"Victoria, a transgender woman, embarks on a journey in search of release from the burden of the body and its limitations.",14775586
643,Or (My Treasure),2004,NA,One man goes on a quest scanning the globe searching for evidence and meaning after aliens abduct him one night from his bed.,0388311
644,Street 60,1976,"Adventure, Biography, Comedy",A moment of youth is a short film compilation that showcases nine up-and-coming directors from seven countries in five continents.,5524664
645,Tea in a Thunder Cup,2012,Drama,"A confrontation between two enemies. One is a young, captured Israeli agent and the other an older Arab inspector who tries to get the agent talk by making him regain his desire to live.",2571032
646,The 90 Minute War,2016,Drama,Captain Ben Jacobson and his platoon are behind enemy lines to install secret military equipment.,4967126
647,The Man Disappeared,,"Adventure, Comedy, Drama","Three friends and couples, mainly Diego, David and Jonathan who will meet with Deborah, Amanda and Angela in their twenties and thirties, want to be filmmakers but are facing with the conservatism of their families who have other plans for them. They will have to make many choices and sacrifices to reach their final destination.::Frederic Eger",5304150
648,Habiographia Shel Ben,2003,Comedy,Sasson works as a greengrocer in the market. He is well known to all around. He has a fair with a healthy lady. One day he is falling in love with a young student who's friend cheating on her.,0417734
649,Andante,2010,Drama,"In the 1980s, Buck Davis was a star player in the Israeli Basketball league. Decades later, a broken Davis returns to Israel at the age of 50 in order to collect his pension and exact revenge on the player who injured him and ruined his NBA career.",1677514
650,Perfect Strangers,2021,Comedy,NA,14037312
651,Another World,2014,Drama,NA,1920846
652,People That Are Not Me,2016,NA,NA,5069012
653,Shelter,2017,"Comedy, Drama",After Avigdor Pumerantz calls the matchmaker in order to find a new wife his children decide to robe him.,6249434
654,Sallah,1964,Drama,NA,0058541
655,Motive to Murder,1966,"Action, Comedy, Drama",A woman is going to a sperm bank to create her first child. There she falls in love with one of the donors. In that sperm bank the best donors are kept frozen with their sperm.,0137807
656,The Untitled Matan Shiram Project,,Drama,"A common crisis changes the complicated relationship between a father and his middle-aged son, both trapped in unhappy marriages.",11101452
657,Love Chapter 2,2017,"Action, Adventure, Comedy",NA,12398004
658,Delayed Reaction,2004,Drama,"He loves her. She loves her. They have issues, trouble in their relationship. It is type for them to make a change, to keep their love alive.",0426260
659,Scouting Patrol,1967,NA,NA,0138077
660,For Making me a Woman,2005,Mystery,NA,14853008
661,Lean neelam Moshe Ivgy,2012,"Action, Biography, Drama","This is a fascinating based on a true story of bravery, brotherhood and the complex reality of war and terrorism. The attack on ""Worshippers Alley"" occurred Saturday night, 15 November 2002, in a narrow alley in Hebron, Near gate area south of Kiryat Arba. During the battle three terrorists,members of the Islamic Jihad movement in Palestine, and 12 Israelis were killed. Some people call this place ""The Death Alley"" or ""The Alley of Heroes"".::Alon Newman",2504518
662,Last Moments,1990,Drama,"In ha-Argazim, a neighborhood that time forgot, the one-year anniversary of Morris Mandabon's death is approaching, and his youngest son, Nissim has had a dream in which his father orders him to re-open the old neighborhood movie theater, thus breaking the vow that Morris had made years before never to screen movies again. Nissim and his brother George, together with Aharon Gabardine, who was the projectionist back in the old days, are determined to fulfill Morris' request. The same day Nissim has his dream, Avram Mandabon, Morris' brother, returns for his brother's memorial after a 25-year absence. His reappearance causes old family feuds to resurface. Seniora Mandabon, late Morris' wife, won't even speak to Avram. Following the advice of Yisrael ""the Indian"", considered the neighborhood authority on films, the brothers decide to screen the Indian-made local hit from years before, ""Sangam"", to which Seniora objects (""Nobody cares to watch old Indian movies!"") and tries to convince them to screen another movie, but they insist. They eventually find out that the only print of ""Sangam"" is in the hands of Avram, their uncle, who refuses to give it to them. And so, as the time for Morris' memorial approaches, as well as the screening date, it seems that a clash is inevitable. In the tense days that follow, the past resurfaces and the brothers learn the secrets of their family history and the real reason why their father closed down the theater.::YosefG",0099985
663,Shattered Perfection,,"Adventure, Family",A film about a special road trip of 3 good friends.,14514500
664,A Married Couple,1983,Drama,A brutal terror attack causes an intense chain of events in one night,0086645
665,Before Tomorrow,1969,Drama,"Against the backdrop of AIDS, the film explores two families, each with a gay son. Jonathan is splitting from Miki because the more experienced Miki is playing around. Then Jonathan sees Thomas, the son and grandson of his neighbors, who is back in Israel after failing to make it as a musician in New York: Thomas is ill, detached, in search of hard drugs. Jonathan tries to connect with him. Meanwhile, Thomas's grandmother, facing old age, has become bitter, particularly toward her hard-working daughter. They worry about Thomas. A few blocks away, Jonathan's mother, brother and sister maintain their sometimes bickering relationships, watching Jonathan brave adulthood.::<jhailey@hotmail.com>",0141551
666,Things,1995,Drama,NA,0135715
667,Fortuneteller,,"Comedy, Drama",Simple people struggle through extraordinary circumstances. Sometimes the only answer to any problem is 'The world is funny so we have to laugh.',9572246
668,No Names on the Doors,1997,"Comedy, Crime, Drama","A police captain needs to balance between protecting the last remaining witness in a trial, and his rapidly disintegrating love life.",0135408
669,Third Body,2020,Comedy,A thief is released from prison and with the help of his friend he tries to avenge the policeman who caught him.,11502882
670,Parano,2005,Drama,"Isaac, a young yeshiva student, is an only child to born again orthodox parents. Trapped in a dysfunctional family and a failing body, Isaac finds refuge in wandering. Tormented by his newfound infertility, Isaac looks for answers in his father dubious past. Wandering through the backstreets of the city, he seeks deliverance.::Anonymous",0180409
671,A Moment of Youth,2011,Drama,"One morning Galia and her boyfriend board a local Jerusalem bus. It is packed with passengers, among them a suicide bomber. The bus explodes, leaving Galia with severe burns and memory loss. She has no memory of the day of the terrorist attack and the days leading up to it. A necklace sent to her from an unidentified source sets her off on a journey to find the missing pieces of the puzzle from that horrific day.::Warsaw Film Festival",1926214
672,Death of a Jew,1969,Drama,"Eight young Israelis find themselves at a life's crossroads. Their common ground is being out of place in their surroundings and they all long for a sense of wholeness and integrity which eludes them. Even so they unconditionally delve into a final delusional quest in search of a satisfying solution to their loss. MYMYM is a journey which concludes by intersecting their paths for the first and last time. Amnon and Miko drive from one end of the country to the other for an underpaid concert. Committed in pursuing their long coveted dream of becoming Rock Stars. Shimrit helps Sharon escape a mental asylum. Together they set out in search of Sharon's son who has been separated from her. Boris, a successful D.J., who has had enough of the party scene, encouraged by his over zealous drug dealer Andre, sets off alone into the desert in search of the comforting sound - silence. Left behind, his girlfriend Ma'Mayan, is quick to console herself in romance with a dreamy street musician. Each person and the path they take. Each path and the surprises at its bend. With some of Israel's less known scenery at the background and exercising free cinematic expressions, the characters' exploits run parallel to each other, crossing back and forth those refined borderlines that seem to persist within our minds - those between reality and imagination.::Daniel Reiss",0066321
673,Point of View,1989,Drama,A strikingly intelligent and beautiful Jewish girl is plucked from obscurity and crowned queen of Persia.,0100382
674,Two Kuni Lemel,1966,Drama,"Chronicle of a Jewish family during and after the Shoah in Poland. Lives filled with suffering and cries. How to survive in a hostile country, where Jew's are tracked down, sold and murdered.",0138101
675,Only Today,1976,Drama,"Peter, freshly widowed at 60, is looking for a new relationship. His son, Rami, finds solace in smoking weed. Peter meets 50 year old Noga, who has a daughter named Nelly. We watch the relationships unfold between the four characters.",0144567
676,Between the Pieces of Life,2019,Drama,NA,20517530
677,What a Gang,1962,Drama,NA,0057132
678,Dreams,1969,Drama,"Seventy-eight-year-old Ze'ev Landsman gives in to family pressure and moves into a retirement home. After a botched escape attempt, he is forcefully returned to the home by his son and daughter-in-law. Although he is now closely watched, Ze'ev refuses to give up on his escape plans. Ze'ev grudgingly accepts the assistance of fellow resident Arye Freund, and the two form a strong bond of friendship as they plan the ultimate escape.::Anonymous",0133835
679,Once Upon Time,1976,"Comedy, Drama, Musical","Pagan priestesses unveil a web of intrigue, betrayal and redemption in this Apocryphal psychedelic-rock re-telling of The Passion.",0183603
680,Marriage Tel Aviv Style,1979,Drama,"n the final installment of this family-friendly adventure trilogy, Ben is basking in the success of his efforts to make his father, Chico happy -- until an unexpected visit from the millionaire married to Chico's ex-wife threatens to rock the boat. The plot thickens when Chico realizes that the rich man's plans to build a shopping mall by the sea could ultimately harm his livelihood as a tour guide.::JM",0144502
681,Blaze on the Water,1969,Drama,"Set in the women's camp at Auschwitz in 1945, the film reveals the power of the young Jewish girls who united and fought the Nazis with their most powerful weapon-faith.",0146973
682,Sbank,2013,Drama,"Engineer Zvi Luria starts showing signs of early dementia, preventing him from completing his big project. He decides to take a job as the unpaid assistant to Asa'el Maimoni, a young engineer involved in a secret military project.",5295324
683,Into the Night,1985,Drama,"When Josh a film director loses his creative juices, his entire world is turned upside down. Then he finds himself even more stuck - in an impossible reality when he is quarantined in his home following the outbreak of the Coronavirus.",0088696
684,"How, What and Why",2020,"Comedy, Drama","Karni feels detached. Detached from the world, detached from her country, detached from her language and even her own body. That is, until she meets Jessica, who happens to be on a much needed break from her dreamlike American life.",15288646
685,Love and Hope,2015,Drama,"A story of tragedy, hope and joy- a journalist's extraordinary experience in the West Bank near the security wall dividing Arab and Jewish land, as he befriends a silent young Arab boy- Said-who spends his time making and flying kites. Welcomed as a guest in the boy's home, he learns of the terrible events in the family's past- but nothing prepares him for the true importance of Said's kites as children's hopes and dreams can fly higher than any wall.::Ira Trattner",4874958
686,Apollo Group Global LLC,2021,Drama,NA,16318368
687,Savage the Man,2017,Drama,NA,6047312
688,Visa,2013,Drama,NA,3002628
689,Mr. Kohl's Final Hour,2019,Drama,"Cheli, 27, is raising her mentally challenged 24yo sister, Gaby, alone. When the social worker finds out that Cheli leaves Gaby alone in the house while Cheli is at work, Cheli is compelled to place Gaby in a day program. For the first time in her life, Cheli shares Gaby's care with someone else; her daily routine collapses and the huge void left by Gaby's absence makes room for a man in Cheli's life in the shape of Zohar, who inadvertently creates a chink in the sisters' symbiotic relationship. While Cheli hangs on to Zohar's love for all she's worth, her inability to have a normal, intimate, and emotional relationship with anyone but her sister forces them into a twisted threesome, where boundaries between love, sacrifice, nurturing, and torturing are crossed.::Liron Ben-Shlush",7430972
690,Little Heroes,2006,"Comedy, Romance",NA,0476546
691,Wounded Land,2015,Comedy,"When they move to Israel to explore their Jewish heritage and revive their flagging marriage, fiftysomething French emigres Alain and Gisele Gaash arrive in Tel Aviv to find their luggage lost, their apartment gone, and Alain's new job taken.::rgbaustx",3489526
692,Mind Fuck,2010,Thriller,"Intense drama based on the 1984 hijacking of bus line 300, in which 41 passengers and a bus driver were attacked and held captive by terrorists in Israel.",1621826
693,Groupie,1993,"Horror, Thriller","In a Dystopian Israel of the near future, a young man brutally rapes young women in the streets, videotapes the deeds and uploads the recordings to the Darknet. After encountering a past victim and developing a relationship with a future victim, his nightmarish world suffers great turmoil.",0133819
694,The World Is Funny,2012,Drama,A wily widower that deals in used furniture fights progress (and city hall).,2104908
695,Mars Turkey,2001,Drama,Two women meet by chance and discover they were both raped by rapist. Individually and together they must confront the past and finally integrate the long repressed trauma into their lives.,0278554
