,Title,Year,Genre,Synopsis,IMDb id
960,Anthrax,2017,Drama,"Fifty-year-old Naomi is a woman who has everything, including a handsome husband and nice kids, but she is collapsing under the ordinariness of her successful life. She loses herself in the circle of housework and children. Just before the breaking point, she agrees to take Nigist, an Ethiopian Christian illegal worker, as a maid. The encounter between the two women channels Naomi's life in a new direction and exposes her to the world of migrant workers living among us. Paradoxically, parallels emerge between the problems of the two women, though their hardships have entirely different origins. This makes possible a temporary friendship between two women who represent two entirely different worlds. The events take place against the background of Israeli society, in which some 300,000 foreign workers live. Since the beginning of the 1980s, some 80,000 Ethiopian Jews have arrived in Israel. This unique wave of immigration attracted great public attention. Few are aware, however that among the workers who arrived to Israel from various African countries, there is also a community of several thousand Ethiopian Christians. The film Foreign Sister tells the story of this small and little known group.",8717236
961,Green,1983,"Crime, Drama","A multi-character, non-linear drama, following the events taking place during the last night in the life of Aaron Cohen.",0133817
962,Tel Aviv Taxi,1956,Drama,"A magnetic young couple bankrolls their colorful lifestyle through clever but corrupt exploits, when the consequences of reality begin to penetrate the invincibility of youth.",0165511
963,Placebo,2013,"Drama, War","A Bedouin woman hides an Israeli pilot from Egyptian soldiers. While the Egyptian soldiers torture her to get information, the Israeli soldiers rescue her.",2980430
964,Agadat Ha'ish Sheshatak,1998,"Comedy, Crime, Drama","Out of the Blue is a comedy about abortive loves and a friendship which survives them. Shabtai, a junk peddler and Herzel, his aide, drive through the streets of Tel Aviv buying and selling used-up furniture and trash. Now and again Shabtai takes a nap and in his dreams a seductive and passionate red-haired woman makes love to him. One day Shabtai discovers her photograph in a face-cream advertisement and realizes the the woman of his dreams exists in reality. He sets out to fing her. But it is Herzel who first wins her attention and then her heart. Herzel, however, loves Batya, Shabtai's daughter.. Out of the Blue is an urban fairy tale, an inverted Cinderella story. Instead of a poor kind hearted young girl - two elderly machos on a decrepit motorcycle; instead of a prince - a princess; instead of a shoe found at midnight - a shabby ping-pong table abandoned in a parking lot.",0171468
965,Four Weddings and a Terrorist Attack,,"Drama, Music","Vered, an attractive blind singer, meets and is befriended by three students. The trio decides to save enough money for the surgery which may restore Vered's sight. After many attempts, two of them commit petty theft and are sent to prison. The third takes Vered to the surgery which is successful. Although Vered regains her sight, she losses her friends...::Anonymous",13644038
966,Not a Word to Morgenstein,1963,"Comedy, Drama, Romance","After an injury upends her ambitious career as a dancer, Mia escapes her life in Tel Aviv for a temporary stay in Brooklyn. Looking for meaning and a new lease on life, she accepts a cat-sitting gig and seduces its owner, hoping to bring back the part of her she fears to have lost forever.",0133340
967,Ha-Proyect Shel Piter Shmychel,2008,Drama,"For Ze'ev, loneliness has never been this tangible. In his sixties, his wife leaves him for another man, and he remains alone with his thoughts, mistakes, jealousy and a faint lust for life and love. Straight from the heart of this restless life, a sudden birth might arrive, to which there was no preceding pregnancy; and perhaps, it won't arrive at all...::Anonymous",0834580
968,Children of Nobody,,"Crime, Drama",A street-smart troublemaker falls in love with the daughter of a respectable man.,12612112
969,Korban HaAhava,1992,Drama,They were three friends who grew up in a boarding school for abandoned children. They separated but they swore to find each other.,8318372
970,Freak Out,2015,Drama,"Based on the true story, of the Jews escaping Komarom in Hungary while it was under Soviet Occupation following the Nazi regime.",3846718
971,Encirclements,2014,"Drama, History",NA,3824038
972,The Owl,1988,Horror,Revelation is a post-apocalyptic horror drama in which four separate but interconnected stories showcase the trials and tribulations of characters trying to find their way and survive this new world of uncertainty.,0153976
973,Circus Palestina,1998,Drama,"The story of Ella, a 30 year old mistress, who wants to mourn the death of her desist lover but can't seem to find a way to do so without reviling their affair to his family.",0163586
974,Black Box,(VII,Drama,An Israeli soldier and a Palestinian teenager are trapped in a basement under the ruins of house that the IDF demolished in the West Bank city of Ramallah.,10804486
975,Tania 403,2002,Drama,NA,0339763
976,"Ya obeshchala, ya uydu...",1992,"Comedy, Romance, Sci-Fi",An Israeli-Lithuanian scientist is asked by a Russian oligarch to develop software that will match people around the world.,0203218
977,Game Over,1996,Drama,"This film about an expressive and intelligent 13-year old boy captures the cultural richness and social complexity of a Jewish boy's life in Tunsinia, North Africa. Based on the autobiographical novel by sociologist Albert Memmi.",0143266
978,Halakhah,2022,Drama,"A single father who shares an apartment with his mother, older brother, and daughter. His challenge is to let go of his daughter in order to protect her from the same destiny.",19050010
979,Rutenberg,2003,Drama,NA,0238960
980,Naomi,2010,"Biography, Drama",NA,1666165
981,A Place by the Sea,1988,History,"Over seven decades ago, The Declaration of Independence of the State of Israel was drafted. Every word and comma led to hours of debate. The declaration was signed, the State established, but the debate still rages.",0151470
982,The Olive Harvest,2003,"Drama, Romance","Love story of a young couple, Amad and Isabella. Amad (25), a Palestinian from Nablus (a city under the control of the Palestinian Authority), and Isabella (25), a Brazilian illegal foreign worker who lives in the city of Tel Aviv, attempt to navigate their lives between the obstacles that face them under the complicated, bleeding reality of life in Israel.",0430426
983,Big Shots,1982,"Drama, Music","Margalit is a simple girl from Ashdod, waiting tables in her father's restaurant. She dreams of making it in the music industry. Everything changes one night when the famous singer Dudu Ben-David performs in Margalit's hometown. He comes to Margalit's pub, discovers her and promises to make her a big star.",0084342
984,Aaron Cohen's Debt,1999,Drama,"What is going on behind the closed doors of the women-only secret club? The first rule is that love is prohibited. When Sophie falls in love with a mysterious man, she must choose between her last chance for true love to her loyalty to the club.::Cinema South Film Festival",0219467
985,Rascals Dawn,,"Comedy, Drama",A mother comes to her son's base to keep him fed,2462238
986,Clouds Over Israel,1966,Drama,NA,0056494
987,Golem,2014,Drama,"As any mother or father will tell you, when it comes to parenting, there's no right way to do it. Discover the highs and lows of being a queer kid in a straight family and vice-versa in these six stories from around the world.",3812648
988,Across the Wall,,Drama,A film teacher had to teach in Sderot and change the lives of his students.,5447956
989,Rita Shem Zemani,2007,Drama,"A story about fathers, sons, and consequence in the days before the flood foretold by Noah.",6790658
990,Snowland,2020,Drama,"As a new conflict opposes Israel and Lebanon, Hajar, a young Palestinian student, returns to her native village in Galilee on the occasion of a wedding in the family. Just before the ceremony, she goes to see her father, patriarch Abu Majd, who has always encouraged her to learn and to discover the world. It is with confidence that she tells him about the man she loves, Matthew, an English art teacher at the university of Haifa. His negative reaction upsets her...::Guy Bellinger",9733150
991,Casablan,1963,Drama,A James Bond-type action hero is assigned to destroy a weapons factory run by a fugitive Nazi.,0212046
992,Chaverim,2017,Drama,NA,8310508
993,Goodbye Komarom,,Drama,NA,6116708
994,Gufa BaCholot,1999,"Comedy, Drama",NA,0235241
995,Revelation,(VI,Drama,"In Israel's Central Prison, the security officer is corrupt, supplying drugs and stirring the hatred between Jewish and Arab prisoners to his advantage. Uri, in for 12 years for armed robbery, and Issan, in for 50 years for PLO violence, command the respect of their cells. When the Arabs are framed for the murder of a Jewish prisoner and a young inmate commits suicide rather than lie about what happened, Uri and Issan form an unlikely partnership, leading the security block on a strike. Prison officials try to break it. In the background are Uri's daughter and Issan's wife, women of beauty and passion who embody the distance from inside a cell to the outside.::<jhailey@hotmail.com>",7926246
996,The Other Widow,,Drama,Two pairs of assassins are sent by a Holocaust survivor's son to bring the last Nazi for a show trial in Israel.,3477758
997,All the Time in the World,2011,Drama,"Jossef Tawila, the legendary tar player of the band Ensemble Tourqouise along with Avram Mufradi composed the Crying Spring Symphony. In the debut evening of the symphony's playing a car accident occurred, as Tawila fell during driving, killing two of the orchestra's members. Surviving the accident, Tawila, Avram Mufradi and Margaret (Tawila's spouse, being the band's singer), who turned to a wheel chair invalid. Tawila is judges and sentences for a few imprisonment years. After his release from jail he abandons his beloved one and music, opens a pub and sinks into a depression. The movie describes the happenings twenty years after the accident. One day on Tawila's threshold appears Amram, Avram Mufradi's son, telling him his father is dying of cancer and asking him to complete assemble an ensemble that will play The Crying Spring Symphony. Tawila decides to make his old friend's last wish come true and goes out to extract the best players for an ensemble to play the piece before his perish::ATaler",5759660
998,Emtza HaSeret,2003,Drama,NA,0333400
999,"Beam Me Up, Sasha!",2014,"Comedy, Romance",A romance set in 21st century Israel between two young Israelis trying to cope with the pressures of love and commitment in a reality that's aggressive hostile and isolating.,2556756
1000,Pillar of Salt,1979,Drama,A German Jewish engineer is the only survivor of a concentration camp where he would work in a counterfeiting unit.,0151722
1001,Ben Zaken,2014,"Comedy, Drama, Romance","Victor and Raya Frenkel were the golden voices of the Soviet film dubbing for decades. All the western movies that reached Soviet screens were dubbed by them. In 1990, with the collapse of Soviet Union, the Frenkels decided to do Aliyah - immigrate to Israel, just like hundreds of thousands of Soviet Jews. There's no need in Israel for Russian speaking dubbing artists, and Victor's and Raya's attempts to use their talent will cause bizarre and unexpected events during their first months in Israel, and turn the beginning of the new chapter of their life into an amusing, painful, and absurd experience.",3835234
1002,The Hero's Wife,1963,"Comedy, Drama",NA,0133740
1003,Arim B'Layla,1998,"Comedy, Romance","Teenage romande, parties and sex in 1950s Tel Aviv. Music is at the core of the lives of these teenagers. This iscomedy about three friends.",0154161
1004,Our Natural Right,2020,"Action, Drama",NA,14981404
1005,Little Simico's Great Fantasy,2011,"Comedy, Drama",During his journey to Jerusalem young James learns the meaning of being Israeli.,2072985
1006,Karaoke with Frank S.,2013,"Action, Crime, Thriller","This action thriller follows a young, successful lawyer, that in a course of a one day has to commit the perfect crime in order to save her family from a psychotic loan-shark",6059736
1007,Dear Mr. Waldman,2006,Drama,"Explores the relationship between an eleven-year-old girl and her ailing mother, who is losing a grasp of reality in the surrounding environment of insensitivity and cruelty.",0823493
1008,My Mother the General,1979,Drama,"Red Cow is a coming-of-age film that takes place in the days leading up to the assassination of Rabin and depicts the life of Benny, 16, orphaned from mother at birth and the only child of Joshua - a religious, right-wing extremist, in those critical junctures when she is forming her sexual, religious and political awareness.",0145835
1009,I Don't Give a Damn,1987,Drama,"The love of Nissim for his widowed sister-in-law, Rosa, in the Old City of Jerusalem at the turn of the century. Under a (very old) Jewish religious law, Nissim has the duty to marry his childless sister-in-law on the death of his brother.",0121490
1010,New Queer Visions: Parental Guidance,2021,Drama,NA,15486344
1011,Herzl's Susita,2018,Drama,NA,9067840
1012,Days of Noah,,Animation,"The film ""Legend of destruction"" tells the story of the Jewish revolt against Rome which ended with the destruction of the Temple in the year 70.",14427170
1013,Hora 79,2013,Drama,"In a Jewish Orthodox village in Israel, Tamar, a twelve-year-old girl, prepares for her Bat-Mitzvah (confirmation), which will take place on Passover. Becoming convinced that she is impure, and growing increasingly scared and depressed, she forces herself into an endless ritual of cleaning, while attempting to silence the whispering inner obsessional thoughts that are detailing every inch of her relentless guilt, over and over again. To make matters worse, Tamar's only friend, Rachel, lures her into sinful mischief: peeping into the Mikveh (bath house), turning a light on during the Sabbath. The girls even dare to secretly bathe at the Mikveh when Tamar gets her first period. Will Tamar succumb to her fears? A dark and unflinching portrayal of Obsessive-Compulsive Disorder and the inner turmoil of an adolescent girl.::Sujit R. Varma",3002584
1014,Trunk to Cairo,1965,Drama,"Paltiel Kossover leaves his home country Russia because of the Jewish persecutions. From Berlin to Paris, he will discover politics, poetry, love before coming back to his native land.",0061123
1015,Robinson und seine wilden Sklavinnen,1972,Drama,NA,0067682
1016,The Great Telephone Robbery,1972,"Adventure, Comedy, Drama","A Tel Aviv taxi breaks down, and while the driver attempts to repair it, the passengers take shelter and relate tales to each other. One man relates how he became a hero, in a comic fashion, while on Army maneuvers; an elderly woman tells of her first visit to the big city; another woman tells how she and her husband invited his boss and his wife to their home for dinner, with the intent of getting the husband a raise, and they wound up in a hospital thinking they had food poisoning. Another story concerns how the police caught a demented-thief who stole from a bank to give money to the poor.::Les Adams <longhorn1939@suddenlink.net>",0148846
1017,Maktub,2017,Drama,"Two young university students wish to escape the oppressive Soviet Union. But their plans are monitored by the KGB, who try to intimidate them. One of them is taken into custody and tortured, which spurs them to make an escape attempt that could cost them their lives.::Fryingham",7252000
1018,Dead End Street,1982,Drama,NA,0125824
1019,Made in Israel,2001,Drama,NA,0290238
1020,A Bottle in the Gaza Sea,2010,Drama,"Alfred spent years as a patient in a mental institution, surrounded by his past. His routine is interrupted when Aristotle, a young new patient with a murky history, is assigned to share his room. Was Aristotle a conscious decision made by his therapist, or perhaps a symptom of Alfred's own illness. Alfred's fears and his reluctance to share his room offer insights into his own past, as well as the past of his young protege, which somehow seems to echo his own. As they become learn about each other and themselves, it becomes increasingly difficult to discern whether these are two distinct individuals brought together by circumstances, or whether Aristotle is simply a ghost of Alfred's turbid past, come to life as part of his treatment.::Anonymous",2082496
1021,Tsili,2014,Drama,A family trip to a Cypriot village seems innocent until the history of the family that used to live there begins to unfold.,3966798
1022,Home,(II,Drama,An experimental fiction-documentary about a crew shooting a movie inspired by Israeli cult singer Meir Ariel's experimental album Rishumey Pecham (Charcoal Drawings).,1784466
1023,The Hour of Truth,1965,"Comedy, Drama",NA,0059266
1024,Night Soldier,1984,Drama,NA,0128562
1025,Working Woman,2018,Drama,"In the heart of Tel-Aviv's Neve Tzedek neighborhood stands an old house that operates as a shelter for youth from broken homes. Jackie, a young man who finds himself running the shelter after the sudden death of its legendary founder, discovers that the old house actually belongs to the municipality of Tel-Aviv, and has been bought by a businessman who's planning to demolish the house and build a boutique hotel on its ruins. Together with the house's at-risk youth, and with the help of a social worker who comes on board, Jackie launches a relentless struggle against the municipality's representatives, to save the house, which, for the youth it shelters-- is their last refuge, their last lifeline.",8844204
1026,Going Steady,1979,"Family, Musical",NA,0079218
1027,Closed Season,2012,Drama,NA,2204370
1028,James' Journey to Jerusalem,2003,"Comedy, Drama","The Simhon family was a radio show on Army Radio in the 1960's. The show was broadcast three times a week in 10 minutes each. In 1964, this film adaptation was produced.",0305178
1029,Suicide,2014,Drama,NA,3714804
1030,A Thin Line,1980,Drama,Urban Odyssey one night in Tel Aviv.,0081621
1031,Galis: The Journey to Astra,2014,Drama,NA,4901934
1032,I Love You Rosa,1972,Drama,NA,0068213
1033,Orange People,2013,"Animation, Comedy",NA,2901396
1034,Love Sick,1995,Drama,NA,0112665
1035,Legend of Destruction,2021,"Action, Comedy, Crime",A Love triangle between a Tel Avivian Stripper and Two Malicious Gangsters who happen to be best friends,4534598
1036,Late Marriage,2001,"Comedy, Music",A group of actors goes to the Negev to film a rock Opera about David and Goliath. The budget is slim so the actors have to find solutions and defend their honor.,0287471
1037,Le testament d'un poète juif assassiné,1987,"Comedy, Music",A dance teacher turned matchmaker searches the obituaries for promising prospects.,0096249
1038,Repeat Dive,1982,Drama,NA,0133290
1039,Why Hast Thou Forsaken Me,2015,Musical,NA,4991396
1040,Gentila,1998,Drama,NA,0143270
1041,Redemption,2018,Drama,"When thirteen year old Aharon,is selected for the great honor of carrying the big Torah book around the neighborhood in 'Simchat Torah' celebrations, he feels life is finally about to change for the better. But his selection causes age-old tensions between his parents to surface, and the symbolic happy ritual becomes a life-threatening struggle.::Anonymous",8666442
1042,"Je T'aime, I Love You Terminal",2010,"Drama, Thriller, War","Yair, a teenage runaway flees from the law into the contested Samaria region. There he bonds with a group of boys who live on a remote hill and become his ""family"" while at the same time drag him into a conflict with their Arab neighbors.",1844692
1043,Fictitious Marriage,1988,"Drama, Music",NA,0099565
1044,B'ezrat HaShem,2022,"Crime, Drama",NA,19048670
1045,Babylon Blues,2011,"Comedy, Drama","Two Israeli truck drivers give a ride to a nun and transport cloth from her convent, while hauling two tons of fish in a refrigerated truck over rough desert terrain.",2539150
1046,Rachamim,2007,Drama,"It all began on one night, when Lily arrived at her therapist's house asking for an emergency session. She wants to explain why she killed her family.",7176214
1047,Hitchhikers,1998,Drama,NA,0162019
1048,Milk & Honey,2001,"Crime, Drama","Based on real events which occurred in 1994 at Ra'anana, Israel. Two 14-year-old teenagers lead themselves downwards into a world of violence, crime, and even murder.",8546902
1049,Chozeh Ahavah,1986,"Comedy, Drama",NA,0133866
1050,The Simhon Family,1964,"Comedy, Drama","Three youngsters invent a "" make good"" application and have to deal with money and success",0137110
1051,Chaver VeAch 2,1999,Drama,The ex-lover of a middle class woman appears on her birthday after 20 years. Both the mother and the daughter are romantically attracted to him.,8314460
1052,Hoze Lech Brach,2008,Drama,NA,5566984
1053,She Is Coming Home,2013,Drama,"Aya, who's waiting for her husband at the airport, picks up a complete stranger instead and drives him to his hotel. The stranger disappears, but leaves Aya with the key to his room, and the question how far she'll go to recreate intimacy.",2965510
1054,Plasticine,2013,"Comedy, Drama",NA,2980684
1055,Bena,2009,Drama,"An exciting drama set towards the end of the 19th century. Faigi, Fruma, Shayna and other girls must confront the everyday life of a small town against the abundant opportunities of the modern world.",1454447
1056,Once upon a time in Tel Aviv,2021,Drama,"Set against the backdrop of another Israeli war, in Tel Aviv, Amir and Johnny's long time friendship is put to the test, right before their 40th birthday as they set out on a quest of self discovery. Amir is grappling with daughter's cancer diagnosis and his crumbling marriage, as his wife issues a restraining order against him. While Johnny is coming to terms with shutting down his mythological bar and breaking up his 6 year relationship with Mickey, just as they're about to walk down the aisle. Both men are lost, living small lives and losing two major loves, a wife and daughter, and despite their immense pain, they're searching for a ray of light, a smile, and a silver lining beyond the dark mountains ahead.::Yoni Zicholtz and Shelly Yosha",14495752
1057,Breaking,1985,Crime,"A Couple goes on a Romantic Vacation. On their way they pick up an old friend of the wife. The husband doesn't know about the history between the two but start to be suspicious. Slowly he is drown toward a dark side inside of him and the demons of his past appear. Back home, while the wife goes abroad for business, The husband meets Frank on new year's eve party. Frank, A charismatic old friend, draws him down toward violent acts he has long abandoned. On the same party he also meets a girl that suddenly lit his darkness and offers him a new love. The husband , failed to realize between reality and imagination, is locked up in the torment of his soul and confronts over and over with the horrible betrayal.",0152427
1058,Shlager,1979,Drama,NA,0079297
1059,My Michael,1974,"Comedy, Crime, Drama",NA,0073383
1060,"Tick, Tick... Boom!",2008,Action,NA,7601668
1061,Take the 'A' Train,2021,Drama,"A beautiful, determined Israeli military investigator fights for justice when she interrogates ruthless young officers accused of brutalizing Arab civilians. Her only escape is a torrid affair with a fellow officer.",15280486
1062,999 Aliza: The Policeman,1967,"Action, Comedy",A surprising and twisted spy comedy about the Mossad's attempts to find out who killed Mahmoud Al-Mabhouh.,0133330
1063,Burning Land,2022,Drama,NA,15202676
1064,HaSipur Shelanu,2022,Drama,"Rita is a screenwriter challenged by writer's block. With the help of her friend, actor Gadi, she struggles with four different scripts about friendship, adultery, and unfulfilled desires. As she writes and rewrites, she sees herself in most of the female parts and Gadi in most of the male parts. In a subplot, Rita becomes interested in a lonely old man with a black spaniel; she wonders about him and what stories he might have to tell. All of the characters are obsessed with asking and answering questions, with desire, and with self-identity.",19363972
1065,Tel Aviv Call Girls,1972,Comedy,A comedy about a millionaire who pretends to be not a millionaire.,0068754
1066,Big Truck and Sister Clare,1974,"Drama, Horror, Thriller",Goldberg is a mediocre computer programmer. Eisenberg is an emotionally disturbed thug. Unfortunately the two cross paths.,5198136
1067,Family,2017,Drama,"For eight and a half years Grego, known as ""The Greek"", is in prison and contimuously planning his revenge former partner, Shaby. So is it a big surprise when the great enemy of Shaby is extracting him from the prison?",6211060
1068,Afula Express,1997,"Comedy, Drama, Romance",Three stories about three women: one is trying to find the right guy; one is trying to get a divorce from her runaway husband so she takes hostages; one turns Tel Aviv upside down in order to save a kitten trapped in a storm drain.,0134028
1069,Buzz,1993,Thriller,NA,0161353
1070,Tied Hands,2006,"Drama, Romance",NA,0833548
1071,Gesta,2017,Drama,"A story of a street walker, who tries to leave the world of prostitution when she gets pregnant.",6511244
1072,First Love,1982,Drama,NA,0133342
1073,Beach Boys,1992,"Comedy, Drama",NA,0143761
1074,Dead Language,,"Comedy, Drama",NA,12839450
1075,"Himmo, King of Jerusalem",1987,NA,"Inside the virtual world - A soldier looks for relationships, a teenager search for porn, women try to find love and the best -or any- lover in the area - outside the virtual world no one is what they seem.",0093192
